-1,0.0,"في تلك المنطقة من العالم","في تلك مجرور من الموصوف","ANN20020115.0022:15",7,11
-1,0.0,"خرجوا من تحت عباءت هم","فعل من تحت المجرور هم","ANN20020115.0022:16",37,41
-1,0.0,"في غرف مظلمة و مقفلة","في مجرور الموصوف و مفعولا","ANN20020115.0022:17",17,21
-1,0.0,"ما تسمي ه اميركا ارهاباً","ما قال ه فلان منصوب","ANN20020115.0022:20",19,23
-1,0.0,"تجارب "" اعتدالية "" مماثلة","مجرور الموصوف مفعولا","ANN20020115.0022:20",31,35
-1,0.0,"الدعم الاميركي ل هذه التجربة","المجرور الموصوف ل هذه الموصوف","ANN20020115.0022:22",10,14
-1,0.0,"الامر الذي ب ه تُسْتَفْتَيان","الفاعل الذي ب ه قال","ANN20020115.0023:3",3,7
-1,0.0,"و منذ كانت الجامعة العربية","و مجرور كانت الموصوف الموصوف","ANN20020115.0023:3",22,26
-1,0.0,"و في نهاية آذار المقبل","و في مجرور آذار مفعولا","ANN20020115.0023:7",15,19
-1,0.0,"المرير بل المريض و المهترئ","مفعولا بل مفعولا و مفعولا","ANN20020115.0023:8",28,32
-1,0.0,"و تلك المكانة في العالم","و تلك مجرور في الموصوف","ANN20020115.0023:10",10,14
-1,0.0,"هذا ليس كل الخبر .","هذا فعل منصوب المضاف ","ANN20020115.0023:11",1,5
-1,0.0,"وضعاً ل لنقاط على الحروف","منصوب ل الموصوف على الموصوف","ANN20020115.0023:12",30,34
-1,0.0,"قومي ل أقعد مطرح ك","فعل ل يفعل المفعول ك","ANN20020115.0023:17",10,14
-1,0.0,"العمليات المسلحة ضد الاحتلال الاسرائيلي","المجرور الموصوف ضد المجرور الموصوف","ANN20020115.0026:4",61,65
-1,0.0,"، من جانب الفلسطيني ،"," من مجرور المضاف ","ANN20020115.0026:4",82,86
-1,0.0,"الدول المطلة على البحر الاحمر","المجرور الموصوف على مجرور الموصوف","ANN20020115.0026:9",4,8
-1,0.0,"ب هذه الشحنة من الاسلحة","ب هذه مجرور من الموصوف","ANN20020115.0026:10",8,12
-1,0.0,"تقع تحت السيطرة الاسرائيلية المباشرة","يفعل تحت المجرور الموصوف الموصوف","ANN20020115.0026:11",23,27
-1,0.0,"ان ها قضية العرب المركزية","ان ها منصوبا المضاف الموصوف","ANN20020115.0026:17",47,51
-1,0.0,"ما تريد ل نفس ها","ما يفعل ل المفعول ها","ANN20020115.0026:19",13,17
-1,0.0,"استشهاد الطفل الاعزل محمد درة","المجرور المضاف الموصوف فلان منصوبا","ANN20020115.0026:25",3,7
-1,0.0,"وقعتا على تسوية مع اسرائيل","فعل على المفعول مع فلان","ANN20020115.0026:28",9,13
-1,0.0,"، ب عبارة اخرى ،"," ب مجرور الموصوف ","ANN20020115.0026:29",3,7
-1,0.0,"ان تكون ثورة العرب أجمعين","ان تكون المفعول المضاف الموصوف","ANN20020115.0026:29",9,13
-1,0.0,"ان تكون فضيحة ل اسرائيل","ان تكون المفعول ل فلان","ANN20020115.0026:32",11,15
-1,0.0,"و تبرير ها هذه العمليات","و مجرور ها هذه الموصوف","ANN20020115.0026:34",8,12
-1,0.0,"الارهاب ، ارهاب دولة اسرائيل","مجرور منصوبا المضاف فلان","ANN20020115.0026:35",12,16
-1,0.0,"المحتشدة على الحدود مع باكستان","مفعولا على مجرور مع فلان","ANN20020115.0029:2",23,27
-1,0.0,"وقف الارهاب عبر الحدود عمليا","المجرور المضاف عبر المجرور منصوبا","ANN20020115.0029:6",20,24
-1,0.0,"جامو العاصمة الشتوية ل لولاية","فلان منصوبا الموصوف ل الموصوف","ANN20020115.0029:10",17,21
-1,0.0,"حدة التوتر بين البلدين الجارين","مجرور المضاف بين المجرور منصوبا","ANN20020115.0029:15",36,40
-1,0.0,"باتت الان في الملعب الهندي","فعل منصوب في المفعول الموصوف","ANN20020115.0029:20",13,17
-1,0.0,"التوتر بين الهند و باكستان","المجرور بين فلان و فلان","ANN20020115.0029:26",16,20
-1,0.0,"و هنا جدول الاعمال :","و هنا المجرور المضاف ","ANN20020115.0032:3",1,5
-1,0.0,"ثم اعيدوا الى الخدمة الفعلية","ثم فعل الى المفعول الموصوف","ANN20020115.0032:6",14,18
-1,0.0,"الوزارة و صندوق الامم المتحدة","المجرور و الموصوف المضاف الموصوف","ANN20020115.0032:17",33,37
-1,0.0,"ل لتعليم المهني و التقني","ل مجرور الموصوف و مفعولا","ANN20020115.0032:19",18,22
-1,0.0,"خلافاً ل رأي ديوان المحاسبة","منصوب ل الموصوف المضاف المضاف","ANN20020115.0032:21",8,12
-1,0.0,"جراء انهاء عقدي الهاتف الخليوي","جراء المجرور المضاف المضاف الموصوف","ANN20020115.0032:22",15,19
-1,0.0,"ورود رأي مجلس شورى الدولة","المجرور المضاف المضاف المضاف المضاف","ANN20020115.0032:27",18,22
-1,0.0,"سبحاني زار نقيب المحررين :","فلان فعل المفعول المضاف ","ANN20020115.0035:1",10,14
-1,0.0,"عدد من اعضاء مجلس النقابة","المجرور من الموصوف المضاف المضاف","ANN20020115.0035:2",25,29
-1,0.0,"تتخذ ها في الساعات الحرجة","يفعل ها في المفعول الموصوف","ANN20020115.0035:5",34,38
-1,0.0,"يجب ان تتقيد ب ها","يفعل ان يفعل ب ها","ANN20020115.0035:6",14,18
-1,0.0,"يصطلح على تسميت ه الارهاب","يفعل على المفعول ه منصوبا","ANN20020115.0035:8",25,29
-1,0.0,"و المنطقة في شكل عام","و مجرور في الموصوف الموصوف","ANN20020115.0035:8",51,55
-1,0.0,"هيمنت ها و سيطرت ها","المجرور ها و الموصوف ها","ANN20020115.0035:8",57,61
-1,0.0,"يهم نا في الدرجة الاولى","يفعل نا في المفعول الموصوف","ANN20020115.0035:9",24,28
-1,0.0,"التي لا حصر ل ها","التي لا منصوبا ل ها","ANN20020115.0035:9",72,76
-1,0.0,"لدى العالم العربي و الاسلامي","لدى المجرور الموصوف و مفعولا","ANN20020115.0035:10",16,20
-1,0.0,"ب كل ما هو انسان","ب مجرور ما هو منصوبا","ANN20020115.0035:16",19,23
-1,0.0,"بل قبل ها ب قليل","بل قبل ها ب مجرور","ANN20020115.0040:2",9,13
-1,0.0,"اقرباء و اصدقاء في حمانا","المجرور و الموصوف في فلان","ANN20020115.0040:2",16,20
-1,0.0,"ب اسم "" جانو ""","ب المفعول فلان ","ANN20020115.0040:2",21,25
-1,0.0,"حتى ل اخصام ه السياسيين","حتى ل مجرور ه الموصوف","ANN20020115.0040:4",10,14
-1,0.0,"في حزب "" الوعد ""","في مجرور المضاف ","ANN20020115.0040:4",35,39
-1,0.0,"مثل ها في انتخابات 1996","مثل ها في مجرور 10","ANN20020115.0040:4",67,71
-1,0.0,"خسر انتخابات الـ ، 2000","فعل المفعول الـ 10","ANN20020115.0040:7",4,8
-1,0.0,"الهيئة التنفيذية لـ "" القوات","المجرور الموصوف لـ منصوبا","ANN20020115.0040:12",15,19
-1,0.0,"على مغادرة لبنان الى باريس","على المفعول فلان الى فلان","ANN20020115.0040:12",48,52
-1,0.0,"الساعة الثانية بعد ظهر اليوم","منصوب الموصوف بعد المجرور المضاف","ANN20020115.0040:16",21,25
-1,0.0,"في نبذة وزعت عن ه","في مجرور قال عن ه","ANN20020115.0040:17",3,7
-1,0.0,"النائب السابق الدكتور جان غانم","الفاعل الموصوف منصوبا فلان المعرف","ANN20020115.0040:17",10,14
-1,0.0,"التحق ب جامعة لوفان في","التحق مجرور فلان لوفان فلان","ANN20020115.0040:17",29,33
-1,0.0,"من جامعة ليون في فرنسا","من المفعول فلان في فلان","ANN20020115.0040:18",13,17
-1,0.0,"لـ "" القوات اللبنانية ""","لـ مجرور الموصوف ","ANN20020115.0040:20",8,12
-1,0.0,"مدى اكثر م ما ينبغي","مجرور منصوبا م ما يفعل","ANN20020115.0041:4",33,37
-1,0.0,"اي تأخير في تثبيت الموعد","مجرور المضاف في الموصوف المضاف","ANN20020115.0041:4",50,54
-1,0.0,"ل لمسؤولين الذين التقا هم","ل المفعول الذين قال هم","ANN20020115.0041:6",11,15
-1,0.0,"سما ه الديبلوماسية الهادئة العربية","فعل ه المفعول الموصوف منصوبا","ANN20020115.0041:8",12,16
-1,0.0,"ل رئيس الجمهورية اميل لحود","ل مجرور المضاف فلان المعرف","ANN20020115.0041:8",58,62
-1,0.0,"ب رئاسة عبد المنعم الهوني","ب مجرور فلان المعرف المعرف","ANN20020115.0041:11",44,48
-1,0.0,"على ان يستقبل الرئيس الليبي","على ان يفعل المفعول الموصوف","ANN20020115.0041:12",37,41
-1,0.0,"بيان رسمي عن رئيس الوزراء","المجرور الموصوف عن الموصوف المضاف","ANN20020115.0041:14",5,9
-1,0.0,"التي وجهت الى العقيد القذافي","التي قال الى المفعول فلان","ANN20020115.0041:16",8,12
-1,0.0,"و قبل ذلك لدى موسى","و قبل ذلك لدى فلان","ANN20020115.0041:20",11,15
-1,0.0,"و موقف لبنان من ها","و مجرور فلان من ها","ANN20020115.0042:2",22,26
-1,0.0,"عدد من المواضيع السياسية الداخلية","المجرور من الموصوف الموصوف الموصوف","ANN20020115.0042:2",31,35
-1,0.0,"المهندس جان - لوي قرداحي","منصوبا فلان المعرف المعرف","ANN20020115.0042:3",6,10
-1,0.0,"تقريراً مقتضباً حول هذه المواضيع","مجرور الموصوف حول هذه المجرور","ANN20020115.0042:3",35,39
-1,0.0,"و الاسراع في عملية الخصخصة","و مجرور في الموصوف المضاف","ANN20020115.0042:4",18,22
-1,0.0,"التي اولا ه ايا ها","التي قال ه ايا ها","ANN20020115.0042:8",10,14
-1,0.0,"و جاء في البرقية :","و فعل في المفعول ","ANN20020115.0042:13",1,5
-1,0.0,"و ب اسم الشعب اللبناني","و ب مجرور المضاف الموصوف","ANN20020115.0042:14",32,36
-1,0.0,"الخير و النجاح و الازدهار","مفعولا و مجرور و الموصوف","ANN20020115.0042:15",32,36
-1,0.0,"التواصل بين المسؤولين في البلدين","المجرور بين المجرور في الموصوف","ANN20020115.0042:16",34,38
-1,0.0,"ب الاعياد و السنة الجديدة","ب مجرور و الموصوف الموصوف","ANN20020115.0042:20",10,14
-1,0.0,"و تداول مع ه التطورات","و فعل مع ه المفعول","ANN20020115.0043:2",14,18
-1,0.0,"التي وجهت سابقاً الي ه","التي قال مفعولا الي ه","ANN20020115.0043:3",33,37
-1,0.0,"لدى مقابلت ه ايا ه","لدى المجرور ه ايا ه","ANN20020115.0043:3",41,45
-1,0.0,"عدد من اعضاء مجلس النقابة","المجرور من الموصوف المضاف المضاف","ANN20020115.0043:5",25,29
-1,0.0,"زعيم الاقلية الديموقراطية في ه","منصوب المضاف الموصوف في ه","ANN20020115.0043:10",7,11
-1,0.0,"ب زيارة سيد نا الياس","ب مجرور المضاف نا فلان","ANN20020115.0043:12",28,32
-1,0.0,"ان القلب هو من تكلم","ان المفعول هو من قال","ANN20020115.0043:14",34,38
-1,0.0,"اذا كانت الذريعة هي الامن","اذا كانت المفعول هي منصوبا","ANN20020115.0043:15",15,19
-1,0.0,"بل قبل ها ب قليل","بل قبل ها ب مجرور","ANN20020115.0043:16",9,13
-1,0.0,"اقرباء و اصدقاء في حمانا","المجرور و الموصوف في فلان","ANN20020115.0043:16",16,20
-1,0.0,"ب اسم "" جانو ""","ب المفعول فلان ","ANN20020115.0043:16",21,25
-1,0.0,"حتى ل اخصام ه السياسيين","حتى ل مجرور ه الموصوف","ANN20020115.0043:18",10,14
-1,0.0,"في حزب "" الوعد ""","في مجرور المضاف ","ANN20020115.0043:18",35,39
-1,0.0,"مثل ها في انتخابات 1996","مثل ها في مجرور 10","ANN20020115.0043:18",67,71
-1,0.0,"ب تباين الآراء حول الارهاب","ب مجرور المضاف حول المجرور","ANN20020115.0043:21",14,18
-1,0.0,"و اطلع على مطالب ه","و فعل على المفعول ه","ANN20020115.0044:1",26,30
-1,0.0,"وقّع قبل ايام في بروكسيل","فعل قبل المجرور في فلان","ANN20020115.0044:3",14,18
-1,0.0,"اتفاق الشراكة مع الاتحاد الاوروبي","مجرور المضاف مع المجرور الموصوف","ANN20020115.0044:3",23,27
-1,0.0,"بعد 3 او 4 اشهر","بعد 10 او 10 المجرور","ANN20020115.0044:3",73,77
-1,0.0,"السنة السادسة من توقيع الاتفاق","المجرور الموصوف من الموصوف المضاف","ANN20020115.0044:4",58,62
-1,0.0,"خفض رسوم نا على اوروبا","المجرور المضاف نا على فلان","ANN20020115.0044:4",107,111
-1,0.0,"ف وزير الدولة ميشال فرعون","ف مجرور المضاف فلان المعرف","ANN20020115.0044:5",21,25
-1,0.0,"في الوضعين الاقتصادي و الاجتماعي","في مجرور الموصوف و مفعولا","ANN20020115.0044:8",14,18
-1,0.0,"و خصوصا في بلدة برجا","و منصوب في الموصوف فلان","ANN20020115.0044:9",27,31
-1,0.0,"في عدد كبير من البلدات","في مجرور الموصوف من الموصوف","ANN20020115.0044:13",16,20
-1,0.0,"في وزارة الخارجية و المغتربين","في مجرور الموصوف و مجرور","ANN20020115.0044:16",5,9
-1,0.0,"حتى نهاية كانون الثاني الجاري","حتى المفعول كانون فلان مفعولا","ANN20020115.0044:16",44,48
-1,0.0,"ب ما تبقى من تعيينات","ب ما قال من المفعول","ANN20020115.0044:17",26,30
-1,0.0,"بناء على تعليمات الطبيب المعالج","منصوب على الموصوف المضاف الموصوف","ANN20020115.0044:21",39,43
-1,0.0,"من فلسطين أم من ليبيا","من فلان أم من فلان","ANN20020115.0049:1",3,7
-1,0.0,"بل هي ، اي اسرائيل","بل هي اي فلان","ANN20020115.0049:2",90,94
-1,0.0,"اهل القضية و اخوان هم","المجرور المضاف و الموصوف هم","ANN20020115.0049:7",25,29
-1,0.0,""" التي انشأ ها الصدر"," التي قال ها فلان","ANN20020115.0049:8",48,52
-1,0.0,"في مضمون ها الرسالي الكبير","في مجرور ها الموصوف مفعولا","ANN20020115.0049:8",107,111
-1,0.0,"و أمام عرفات نفس ه","و أمام فلان منصوبا ه","ANN20020115.0049:8",118,122
-1,0.0,"انتصار هم الوحيد على اسرائيل","المفعول هم الموصوف على فلان","ANN20020115.0049:8",198,202
-1,0.0,"و "" شجاعة الشجعان ""","و مجرور المضاف ","ANN20020115.0049:8",230,234
-1,0.0,"( حسب خطاب الصدر )"," حسب المجرور فلان ","ANN20020115.0049:9",19,23
-1,0.0,"لا ب الارتزاق من ها","لا ب مجرور من ها","ANN20020115.0049:9",28,32
-1,0.0,"و في قمة اولويات ها","و في مجرور المضاف ها","ANN20020115.0052:5",16,20
-1,0.0,"تنادي ب كشف مصير هم","يفعل ب المفعول المضاف هم","ANN20020115.0052:5",29,33
-1,0.0,"من دون قيد او شرط","من دون المجرور او الموصوف","ANN20020115.0052:5",53,57
-1,0.0,"و القرار 1284 / 1999","و مجرور 10 10","ANN20020115.0052:5",74,78
-1,0.0,"احب الي نا نحن الكويتيين","مفعولا الي نا نحن منصوبا","ANN20020115.0052:9",9,13
-1,0.0,"اهل نا و اسرا نا","المجرور نا و الموصوف نا","ANN20020115.0052:10",14,18
-1,0.0,"وافق علي ها من البداية","فعل علي ها من المفعول","ANN20020115.0052:11",11,15
-1,0.0,"تقديم ها الى الامم المتحدة","الفاعل ها الى الموصوف الموصوف","ANN20020115.0052:18",15,19
-1,0.0,"و من اخوان نا العرب","و من مجرور نا الموصوف","ANN20020115.0052:19",12,16
-1,0.0,"من الاسرى العراقيين في الكويت","من مجرور الموصوف في فلان","ANN20020115.0052:21",31,35
-1,0.0,"لم تظهر الا عام 1994","لم يفعل الا منصوب 10","ANN20020115.0052:22",10,14
-1,0.0,"و تسيطر علي ها ؟","و فعل علي ها ","ANN20020115.0052:24",1,5
-1,0.0,"ان ل لعراق 1124 مفقوداً","ان ل فلان 10 منصوبا","ANN20020115.0052:27",30,34
-1,0.0,"و تحت مظلة الامم المتحدة","و تحت المجرور المضاف الموصوف","ANN20020115.0052:29",34,38
-1,0.0,"اسر امة ب كامل ها","مجرور المضاف ب الموصوف ها","ANN20020115.0052:30",19,23
-1,0.0,"ل جسر الملولة في طرابلس","ل مجرور فلان في فلان","ANN20020115.0056:1",4,8
-1,0.0,"و فتح ها ل لسيارات","و مجرور ها ل الموصوف","ANN20020115.0056:1",27,31
-1,0.0,"المسؤولية الملقاة على عاتق المختار","المجرور الموصوف على مجرور المضاف","ANN20020115.0056:3",15,19
-1,0.0,"وفقاً ل مواصفات دفاتر الشروط","منصوب ل الموصوف المضاف المضاف","ANN20020115.0056:16",12,16
-1,0.0,"بلدية الدوير ( النبطية )","الفاعل فلان فلان ","ANN20020115.0056:18",3,7
-1,0.0,"اضافة الى براءة ذمة بلدية","منصوب الى الموصوف المضاف المضاف","ANN20020115.0056:19",23,27
-1,0.0,"بلدة العديسة ( مرجعيون )","المجرور فلان منصوبا ","ANN20020115.0057:2",13,17
-1,0.0,"بـ "" الخط الازرق ""","بـ مجرور الموصوف ","ANN20020115.0057:3",30,34
-1,0.0,"و ل وجود حقول الغام","و ل مجرور المضاف المضاف","ANN20020115.0057:3",181,185
-1,0.0,"بعد ما تخطوا البوابة الحديد","بعد ما فعل المفعول المضاف","ANN20020115.0057:4",12,16
-1,0.0,"منذ الاحتلال الاسرائيلي عام 1976","منذ مجرور الموصوف منصوبا 10","ANN20020115.0057:4",85,89
-1,0.0,"ركبت علي ها اجهزة رصد","فعل علي ها الفاعل المضاف","ANN20020115.0057:5",15,19
-1,0.0,"فيما جابت سيارة عسكرية المنطقة","فيما فعل الفاعل الموصوف المفعول","ANN20020115.0057:5",43,47
-1,0.0,"ملالتان تابعتان ل لكتيبة الهندية","الفاعل الموصوف ل مجرور الموصوف","ANN20020115.0057:6",6,10
-1,0.0,"و خصوصا اراضي بلدة العديسة","و منصوبا مجرور المضاف فلان","ANN20020115.0057:7",59,63
-1,0.0,"الدماء التي روت هذه الارض","منصوب التي قال هذه المفعول","ANN20020115.0057:8",44,48
-1,0.0,"لا يمكن ان تذهب اهدارا","لا يفعل ان يفعل منصوب","ANN20020115.0057:8",49,53
-1,0.0,"و تأمين مستقبل اولاد هم","و مجرور المضاف المضاف هم","ANN20020115.0057:12",16,20
-1,0.0,"في هذه الظروف الاقتصادية الصعبة","في هذه مجرور الموصوف الموصوف","ANN20020115.0057:12",24,28
-1,0.0,"الالغام التي يتحدثون عن ها","مجرور التي قال عن ها","ANN20020115.0057:13",4,8
-1,0.0,"غائماً حيناً ، صافياً حيناً","مفعولا مجرور مفعولا المجرور","ANN20020115.0058:2",10,14
-1,0.0,"هي الاساس في حال الطقس","هي منصوب في الموصوف المضاف","ANN20020115.0058:3",14,18
-1,0.0,"و يجب الانتظار ل تتغير","و فعل الفاعل ل يفعل","ANN20020115.0058:4",24,28
-1,0.0,"المناطق حتى ارتفاع 580 متراً","مجرور حتى الموصوف 10 منصوبا","ANN20020115.0058:5",38,42
-1,0.0,"حتى الحادية عشرة قبل الظهر","حتى الموصوف المفعول قبل المجرور","ANN20020115.0059:12",7,11
-1,0.0,"الا عند العاشرة قبل الظهر","الا منصوب الموصوف قبل المجرور","ANN20020115.0059:15",43,47
-1,0.0,"يدرسون في ثانوية الكفير الرسمية","فعل في مفعولا فلان مفعولا","ANN20020115.0059:17",6,10
-1,0.0,"التعليمات اللازمة ل فتح ها","المجرور الموصوف ل مجرور ها","ANN20020115.0059:17",14,18
-1,0.0,"المسؤولية الملقاة على عاتق المختار","المجرور الموصوف على مجرور المضاف","ANN20020115.0059:19",15,19
-1,0.0,"بعد هدوء استمر 10 ايام","بعد المجرور قال 10 منصوب","ANN20020115.0059:23",15,19
-1,0.0,"و راشيا و البقاع الغربي","و فلان و الموصوف الموصوف","ANN20020115.0059:25",15,19
-1,0.0,"حلقت 4 طوافات فوق المزارع","فعل 10 الفاعل فوق المجرور","ANN20020115.0059:25",32,36
-1,0.0,"ابرشية عكار ل لروم الارثوذكس","المجرور فلان ل فلان الموصوف","ANN20020115.0059:28",3,7
-1,0.0,"المسؤول عن جهاز امن الدولة","منصوب عن الموصوف المضاف المضاف","ANN20020115.0059:28",40,44
-1,0.0,"الى "" المقسم 19 ""","الى مجرور 10 ","ANN20020115.0061:1",2,6
-1,0.0,"من شارع قشوع الاشرفية الجعيتاوي","من مجرور فلان فلان المعرف","ANN20020115.0061:2",3,7
-1,0.0,"و طالبوا ب تأمين ه","و فعل ب المفعول ه","ANN20020115.0061:3",30,34
-1,0.0,"الاتصال ب ه في المؤسسة","الفاعل ب ه في مفعول","ANN20020115.0061:8",14,18
-1,0.0,"ل أكثر من ثلاثة اشهر","ل المفعول من 10 الموصوف","ANN20020115.0061:10",33,37
-1,0.0,"رغم وعود هم ل ي","رغم المجرور هم ل ي","ANN20020115.0061:11",14,18
-1,0.0,"الذي يبعد نحو 150 مترا","الذي يفعل نحو 10 المجرور","ANN20020115.0061:12",36,40
-1,0.0,"ادفع الاشتراكات من دون تأخير","يفعل المفعول من دون المجرور","ANN20020115.0061:13",24,28
-1,0.0,"تكن كمية المياه التي تصل","تكن المرفوع المضاف التي يفعل","ANN20020115.0061:14",41,45
-1,0.0,"الموجود في ه العيار حاليا","مفعولا في ه مجرور مفعولا","ANN20020115.0061:15",14,18
-1,0.0,"في عقار مخصص ل لزراعة","في مجرور الموصوف ل مجرور","ANN20020115.0061:15",24,28
-1,0.0,"وزير الاتصالات السلكية و اللاسلكية","المجرور المضاف الموصوف و مفعولا","ANN20020115.0061:18",5,9
-1,0.0,"و اصلاح الاعطال في هما","و مجرور المضاف في هما","ANN20020115.0061:23",29,33
-1,0.0,"المسجون في قفص رام الله","مفعولا في مجرور فلان المعرف","ANN20020115.0065:2",28,32
-1,0.0,"على "" كارين اي ""","على فلان المعرف ","ANN20020115.0065:3",7,11
-1,0.0,"- على غير عادة -"," على غير المجرور ","ANN20020115.0065:3",12,16
-1,0.0,"و من هم بعض الاسرائيليين","و من هم منصوبا المضاف","ANN20020115.0065:5",46,50
-1,0.0,"المال في السلطة و منظمة","المال المفعول السلطة الموصوف المضاف","ANN20020115.0065:6",72,76
-1,0.0,"ما بدأ بعد 11 ايلول","ما قال بعد 10 ايلول","ANN20020115.0065:12",7,11
-1,0.0,"توقف عند حدود حرب 1948","فعل منصوب المضاف المضاف 10","ANN20020115.0065:12",53,57
-1,0.0,"عالم ما بعد 11 أيلول","منصوب ما بعد 10 أيلول","ANN20020115.0065:14",47,51
-1,0.0,"التسليم الكامل ب المشيئة الاميركية","المجرور الموصوف ب الموصوف الموصوف","ANN20020115.0065:15",16,20
-1,0.0,"الذي كان سائداً عام 1948","الذي كان الموصوف مجرور 10","ANN20020115.0065:15",35,39
-1,0.0,"المسؤول عن هجمات 11 ايلول","منصوب عن الموصوف 10 ايلول","ANN20020115.0065:16",31,35
-1,0.0,"ان يطلب من ها ذلك","ان فعل من ها ذلك","ANN20020115.0065:16",43,47
-1,0.0,"ب السر و ب العلن","ب مجرور و ب الموصوف","ANN20020115.0065:16",50,54
-1,0.0,"ما يجري من حول ها","ما يفعل من حول ها","ANN20020115.0065:16",82,86
