-1,0.0,"وجود الرئيس كلينتون في اليابان","المجرور المضاف فلان في فلان","20000715_AFP_ARB.0012:4",30,34
-1,0.0,"و ب حلول ذلك الوقت","و ب مجرور ذلك المضاف","20000715_AFP_ARB.0012:7",6,10
-1,0.0,""" ترتيبات "" مع الفلسطينيين"," المجرور مع المجرور","20000715_AFP_ARB.0012:7",18,22
-1,0.0,"حسب مسؤول فلسطيني في غزة","حسب المجرور الموصوف في فلان","20000715_AFP_ARB.0012:9",43,47
-1,0.0,"صحيفة "" تشرين "" الحكومية","الفاعل فلان الموصوف","20000715_AFP_ARB.0013:1",9,13
-1,0.0,"القدس و قضية اللاجئين الفلسطينيين","فلان و الموصوف المضاف الموصوف","20000715_AFP_ARB.0013:4",41,45
-1,0.0,"السخط و الغضب و الاستنكار","المجرور و الموصوف و مجرور","20000715_AFP_ARB.0013:6",17,21
-1,0.0,"سوى دفع الاوضاع الى الانفجار","سوى المجرور المضاف الى الموصوف","20000715_AFP_ARB.0013:6",29,33
-1,0.0,"جراء اعمال عنف في الجزائر","جراء المجرور المضاف في فلان","20000715_AFP_ARB.0014:1",32,36
-1,0.0,"منذ بداية تموز / يوليو","منذ مجرور تموز فلان","20000715_AFP_ARB.0014:9",4,8
-1,0.0,"حصيلة اعدت استنادا الى الصحف","المجرور قال منصوب الى الموصوف","20000715_AFP_ARB.0014:9",32,36
-1,0.0,"كما ان ها لم تنف","كما ان ها لم يفعل","20000715_AFP_ARB.0014:10",5,9
-1,0.0,"تنفيذ تسليم ( السود )","المجرور المضاف المضاف ","20000715_AFP_ARB.0015:2",13,17
-1,0.0,"المحاربين القدامى في حرب الاستقلال","المجرور منصوبا في الموصوف المضاف","20000715_AFP_ARB.0015:3",9,13
-1,0.0,"في شباط / فبراير الماضي","في شباط فلان مفعولا","20000715_AFP_ARB.0015:3",22,26
-1,0.0,"بغية نزع الملكية عن ها","منصوب المضاف المضاف عن ها","20000715_AFP_ARB.0015:3",40,44
-1,0.0,"و حل الجيش السوري ثانيا","و فعل فلان الموصوف مفعولا","20000715_AFP_ARB.0016:2",32,36
-1,0.0,"و جاء الجيش وصيفا ايضا","و فعل فلان مفعولا ايضا","20000715_AFP_ARB.0016:2",51,55
-1,0.0,"تبول ( شمال السعودية )","فلان منصوبا فلان ","20000715_AFP_ARB.0016:3",11,15
-1,0.0,"و فاز في ها 4-1","و فعل في ها 10","20000715_AFP_ARB.0016:3",45,49
-1,0.0,"تعاقدات عدة مع لاعبين اجانب","المفعول الموصوف مع المجرور الموصوف","20000715_AFP_ARB.0016:6",9,13
-1,0.0,"اثر انتهاء فترة عقود هم","اثر المجرور المضاف المضاف هم","20000715_AFP_ARB.0016:6",67,71
-1,0.0,"كان محط انظار مسؤولي الهلال","كان المرفوع المضاف المضاف فلان","20000715_AFP_ARB.0016:7",51,55
-1,0.0,"تزخر ب ها صفوف ه","فعل ب ها الفاعل ه","20000715_AFP_ARB.0016:12",25,29
-1,0.0,"( نحو 5400 دولار )"," نحو 10 المجرور ","20000715_AFP_ARB.0016:13",34,38
-1,0.0,"ب حوزة حماد ب الذات","ب مجرور فلان ب الموصوف","20000715_AFP_ARB.0017:2",11,15
-1,0.0,"على هذه الدرجة من الاهمية","على هذه مجرور من الموصوف","20000715_AFP_ARB.0019:2",21,25
-1,0.0,"من دون اشراف خبراء آثار","من دون المجرور المضاف المضاف","20000715_AFP_ARB.0019:2",34,38
-1,0.0,"تمكنوا من الكشف على الردم","فعل من المفعول على الموصوف","20000715_AFP_ARB.0019:3",7,11
-1,0.0,"تشرف على باحة المسجد الاقصى","يفعل على المفعول المضاف فلان","20000715_AFP_ARB.0019:4",12,16
-1,0.0,"تظاهرات دامية في الاراضي الفلسطينية","مجرور الموصوف في الموصوف الموصوف","20000715_AFP_ARB.0019:7",5,9
-1,0.0,"المواضيع المتوقعة ل ليوم السبت","المجرور الموصوف ل مجرور منصوبا","20000715_AFP_ARB.0020:1",12,16
-1,0.0,"مناقشات واسعة على المستوى الوطني","المجرور الموصوف على الموصوف الموصوف","20000715_AFP_ARB.0020:1",41,45
-1,0.0,"10 ، 30 ت غ","10 10 فلان المعرف","20000715_AFP_ARB.0020:2",3,7
-1,0.0,"على اطراف الصين و منغوليا","على مجرور فلان و فلان","20000715_AFP_ARB.0020:2",33,37
-1,0.0,"الشركة الاميركية "" بيلزبوري ""","مجرور الموصوف فلان ","20000715_AFP_ARB.0021:1",35,39
-1,0.0,"مجلس ادارة "" دياجيو ""","الفاعل المضاف فلان ","20000715_AFP_ARB.0021:2",15,19
-1,0.0,"بين 30 الى 33 %","بين 10 الى 10 ","20000715_AFP_ARB.0021:4",14,18
-1,0.0,"ان يعلن عن الصفقة الاثنين","ان يفعل عن المفعول منصوب","20000715_AFP_ARB.0021:5",4,8
-1,0.0,""" هاغن - داز """," فلان المعرف ","20000715_AFP_ARB.0021:6",9,13
-1,0.0,"في اشارة الى جورج سبيت","في مجرور الى فلان المعرف","20000715_AFP_ARB.0022:3",27,31
-1,0.0,"ب قيادة مقرب من سبيت","ب مجرور المضاف من فلان","20000715_AFP_ARB.0022:4",17,21
-1,0.0,"منح ل فريق جورج سبيت","فعل ل المفعول فلان المعرف","20000715_AFP_ARB.0022:6",18,22
-1,0.0,"40 % من التعداد السكاني","10 من الموصوف الموصوف","20000715_AFP_ARB.0022:7",25,29
-1,0.0,"ثاني افضل رقم ل ه","مفعولا مفعولا مجرور ل ه","20000715_AFP_ARB.0023:2",8,12
-1,0.0,"في اقل من 10 ثوان","في مفعولا من 10 مجرور","20000715_AFP_ARB.0023:3",13,17
-1,0.0,"قادر على فعل كل شىء","مفعولا على مجرور المضاف المضاف","20000715_AFP_ARB.0023:3",31,35
-1,0.0,"تحقيق 60 ر 9 ثوان","منصوب 10 فلان 10 منصوبا","20000715_AFP_ARB.0023:3",46,50
-1,0.0,"الذين هزموا غرين هذا العام","الذين قال فلان هذا منصوب","20000715_AFP_ARB.0023:5",9,13
-1,0.0,"منتخب البرتغال و نادي بنفيكا","المجرور فلان و الموصوف فلان","20000715_AFP_ARB.0025:1",19,23
-1,0.0,"ب نحو 16 مليون دولار","ب نحو 10 10 المجرور","20000715_AFP_ARB.0025:2",29,33
-1,0.0,"احد افراد منتخب بلاد ه","منصوب المضاف المضاف المضاف ه","20000715_AFP_ARB.0025:4",8,12
-1,0.0,"قبل انتقال ه الى ايطاليا","قبل المجرور ه الى فلان","20000715_AFP_ARB.0025:7",19,23
-1,0.0,"و غواتيمالا و الولايات المتحدة","و فلان و الموصوف الموصوف","20000715_AFP_ARB.0026:2",44,48
-1,0.0,"بين عامي 1504 و 1990","بين المجرور 10 و 10","20000715_AFP_ARB.0027:3",7,11
-1,0.0,"اقامت في ه عائلة باخ","فعل في ه الفاعل فلان","20000715_AFP_ARB.0027:4",6,10
-1,0.0,"حتى وفات ه عام 1619","حتى مجرور ه منصوبا 10","20000715_AFP_ARB.0027:4",28,32
-1,0.0,"ان الاستقلال ل مونتنينغرو هو","ان منصوب ل مونتنينغرو هو","20000715_AFP_ARB.0029:3",13,17
-1,0.0,"قبل ان ينفصل عن ه","قبل ان يفعل عن ه","20000715_AFP_ARB.0029:6",21,25
-1,0.0,"لن تكون قادرة على الاستمرار","لن تكون مفعولا على مجرور","20000715_AFP_ARB.0029:9",11,15
-1,0.0,"التي تشد ه الى صربيا","التي يفعل ه الى فلان","20000715_AFP_ARB.0029:9",29,33
-1,0.0,"ما قال في حديث صحافي","ما قال في المفعول الموصوف","20000715_AFP_ARB.0029:13",27,31
-1,0.0,"اربعين ب المئة يريدون الاستقلال","10 ب 10 قال المفعول","20000715_AFP_ARB.0029:14",29,33
-1,0.0,"تراجع علاقات التعاون مع صربيا","المجرور المضاف المضاف مع فلان","20000715_AFP_ARB.0029:16",12,16
-1,0.0,"على اطراف الصين و منغوليا","على مجرور فلان و فلان","20000715_AFP_ARB.0030:1",28,32
-1,0.0,"الوضع الاقتصادي الراكد في ها","المجرور المضاف الموصوف في ها","20000715_AFP_ARB.0030:1",40,44
-1,0.0,"تتالف من ها روسيا الاتحادية","فعل من ها فلان الموصوف","20000715_AFP_ARB.0030:2",49,53
-1,0.0,"و نحو الف اجنبي فقط","و نحو 10 المجرور فقط","20000715_AFP_ARB.0030:3",41,45
-1,0.0,"الحوض الرئيسي ل نهر اوب","مجرور الموصوف ل الموصوف فلان","20000715_AFP_ARB.0030:4",29,33
-1,0.0,"الصيد ب مختلف انواع ه","المجرور ب الموصوف المضاف ه","20000715_AFP_ARB.0030:5",31,35
-1,0.0,"التقاء نهري بيا و كاتون","المجرور المضاف فلان و فلان","20000715_AFP_ARB.0030:10",10,14
-1,0.0,"150 روبلا اي خمسة دولارات","10 مجرور اي 10 منصوبا","20000715_AFP_ARB.0030:11",9,13
-1,0.0,"جمعية ل لدفاع عن البيئة","الفاعل ل الموصوف عن الموصوف","20000715_AFP_ARB.0030:12",3,7
-1,0.0,"لاريسا نيمولاييفا المسؤولة في ها","فلان المعرف منصوبا في ها","20000715_AFP_ARB.0030:12",34,38
-1,0.0,"الوصول الى هذه الجمهورية النائية","المجرور الى هذه الموصوف الموصوف","20000715_AFP_ARB.0030:13",21,25
-1,0.0,"السفر ب الطائرة من موسكو","الفاعل ب الموصوف من فلان","20000715_AFP_ARB.0030:13",28,32
-1,0.0,"انتخاب ه رئيسا ل لجمهورية","المجرور ه منصوبا ل الموصوف","20000715_AFP_ARB.0031:1",23,27
-1,0.0,"تطلعات و أماني شعب نا","المجرور و الموصوف منصوبا نا","20000715_AFP_ARB.0031:3",18,22
-1,0.0,"و عاصمت ها القدس الشريف","و منصوبا ها فلان الموصوف","20000715_AFP_ARB.0031:3",55,59
-1,0.0,"كما ادت الى انزلاقات تربة","كما فعل الى المفعول المضاف","20000715_AFP_ARB.0032:1",41,45
-1,0.0,"ل ليوم الخامس على التوالي","ل مجرور الموصوف على الموصوف","20000715_AFP_ARB.0033:1",28,32
-1,0.0,"ب الالتزام ب الثوابت الفلسطينية","ب مجرور ب الموصوف الموصوف","20000715_AFP_ARB.0033:1",34,38
-1,0.0,"و يتنكر ل لشرعية الدولية","و يفعل ل المفعول الموصوف","20000715_AFP_ARB.0033:3",31,35
-1,0.0,"ب قدرت نا على المجابهة","ب مجرور نا على الموصوف","20000715_AFP_ARB.0033:3",40,44
-1,0.0,"دور نا النضالي و الكفاحي","مجرور نا الموصوف و مفعولا","20000715_AFP_ARB.0033:4",23,27
-1,0.0,"ب دور نا نفس ه","ب مجرور نا منصوبا ه","20000715_AFP_ARB.0033:4",51,55
-1,0.0,"يتمخض عن ها من قرارات","يفعل عن ها من المفعول","20000715_AFP_ARB.0033:5",41,45
-1,0.0,""" حق العودة مقدس """," مجرور المضاف مفعولا ","20000715_AFP_ARB.0033:6",31,35
-1,0.0,"الوفد المفاوض في كامب ديفيد","مجرور الموصوف في فلان المعرف","20000715_AFP_ARB.0033:6",38,42
-1,0.0,"رايا انتقاديا ب هذا الوضوح","مجرور منصوبا ب هذا الموصوف","20000715_AFP_ARB.0034:3",27,31
-1,0.0,"علي نا ك وكالة انباء","علي نا ك الموصوف المضاف","20000715_AFP_ARB.0034:3",36,40
-1,0.0,"انتقادا ل نوعيت ه الرديئة","مجرور ل الموصوف ه الموصوف","20000715_AFP_ARB.0034:4",7,11
-1,0.0,"شعرت ب ه على يبدو","فعل ب ه على يفعل","20000715_AFP_ARB.0034:4",16,20
-1,0.0,"لدى خروج هم من القاعة","لدى المجرور هم من الموصوف","20000715_AFP_ARB.0034:4",38,42
-1,0.0,"على ناقد سينمائي او اثنين","على مجرور الموصوف او 10","20000715_AFP_ARB.0034:4",47,51
-1,0.0,"على نور الشريف نفس ه","على فلان المعرف منصوبا ه","20000715_AFP_ARB.0034:4",65,69
-1,0.0,"صحيفة "" تشرين "" السورية","الفاعل فلان الموصوف","20000715_AFP_ARB.0035:1",9,13
-1,0.0,"ل صبر سوريا حيال اسرائيل","ل مجرور فلان حيال فلان","20000715_AFP_ARB.0036:2",18,22
-1,0.0,"من حزيران / يونيو 1967","من حزيران فلان 10","20000715_AFP_ARB.0036:5",36,40
-1,0.0,"في قمة كامب ديفيد الثانية","في مجرور فلان المعرف الموصوف","20000715_AFP_ARB.0036:8",8,12
-1,0.0,"بعد 22 عاما من الاحتلال","بعد 10 المجرور من الموصوف","20000715_AFP_ARB.0036:9",40,44
-1,0.0,"في نهاية تموز / يوليو","في المفعول تموز فلان","20000715_AFP_ARB.0037:1",19,23
-1,0.0,"ناطق ب اسم المنظمة الدولية","الفاعل ب الموصوف المضاف الموصوف","20000715_AFP_ARB.0037:1",34,38
-1,0.0,"زيادة الصادرات من النفط الخام","المجرور المضاف من الموصوف الموصوف","20000715_AFP_ARB.0037:3",20,24
-1,0.0,""" النفط مقابل الغذاء """," المجرور منصوبا المضاف ","20000715_AFP_ARB.0037:3",28,32
-1,0.0,"من 30 آب / اغسطس","من 10 آب فلان","20000715_AFP_ARB.0038:1",19,23
-1,0.0,"من الفرصة المتاحة ل هم","من مجرور الموصوف ل هم","20000715_AFP_ARB.0038:2",35,39
-1,0.0,"الشركات و المؤسسات و الافراد","منصوب و الموصوف و الموصوف","20000715_AFP_ARB.0038:3",19,23
-1,0.0,"بغية الاستفادة من هذا العفو","منصوب المضاف من هذا الموصوف","20000715_AFP_ARB.0038:6",2,6
-1,0.0,"من 350 الف عامل اجنبي","من 10 10 مجرور الموصوف","20000715_AFP_ARB.0038:6",11,15
-1,0.0,"منذ ما يقارب العشرة اعوام","منذ ما يفعل 10 المفعول","20000715_AFP_ARB.0039:1",27,31
-1,0.0,"ان الحصار المفروض على العراق","ان منصوب الموصوف على فلان","20000715_AFP_ARB.0039:4",19,23
-1,0.0,"طالبا عدم ذكر اسم ه","مفعولا مجرور المضاف المضاف ه","20000715_AFP_ARB.0040:4",5,9
-1,0.0,"اي تهديد ل لدول الاخرى","المفعول المضاف ل الموصوف الموصوف","20000715_AFP_ARB.0040:4",29,33
-1,0.0,"لم يوضح مكان اجراء التجربة","لم يفعل المفعول المضاف المضاف","20000715_AFP_ARB.0040:5",19,23
-1,0.0,"الولايات المتحدة و خصوصا اسرائيل","المجرور الموصوف و الموصوف فلان","20000715_AFP_ARB.0040:6",8,12
-1,0.0,""" شهاب - 4 """," فلان 10 ","20000715_AFP_ARB.0040:7",18,22
-1,0.0,""" شهاب - 3 """," فلان 10 ","20000715_AFP_ARB.0040:7",29,33
-1,0.0,"س يكون نقل قمر صناعي","س يكون المفعول المضاف الموصوف","20000715_AFP_ARB.0040:7",46,50
-1,0.0,"و خصوصا المتمولين من هم","و منصوبا مجرور من هم","20000715_AFP_ARB.0041:1",42,46
-1,0.0,"13 ، 30 ت غ","10 10 فلان المعرف","20000715_AFP_ARB.0041:2",3,7
-1,0.0,"بدأت اليوم السبت في طهران","فعل منصوب منصوبا في فلان","20000715_AFP_ARB.0042:1",41,45
-1,0.0,"الى جانب ستة اشخاص اخرين","الى مجرور 10 المضاف الموصوف","20000715_AFP_ARB.0042:2",10,14
-1,0.0,"ل لناشط الاصولي فرهد ابراهيمي","ل مجرور الموصوف فلان المعرف","20000715_AFP_ARB.0042:2",26,30
-1,0.0,"تنظم تظاهرات مناهضة ل لاصلاحيين","يفعل المفعول الموصوف ل مجرور","20000715_AFP_ARB.0042:6",16,20
-1,0.0,"ب حسب المصدر نفس ه","ب حسب المجرور منصوبا ه","20000715_AFP_ARB.0042:8",4,8
-1,0.0,"هذا "" الشريط المزور ""","هذا المجرور الموصوف ","20000715_AFP_ARB.0042:10",13,17
-1,0.0,"ل ما قامت ب ه","ل ما قال ب ه","20000715_AFP_ARB.0042:11",13,17
-1,0.0,"و في مكتب هذا الاخير","و في مجرور هذا المضاف","20000715_AFP_ARB.0042:11",28,32
-1,0.0,"احد الضباط الذين يتولون التدريب","الفاعل المضاف الذين قال المفعول","20000715_AFP_ARB.0044:1",40,44
-1,0.0,"بين 14 و 18 سنة","بين 10 و 10 المجرور","20000715_AFP_ARB.0044:2",39,43
-1,0.0,"( جنوب قطاع غزة )"," منصوب المضاف فلان ","20000715_AFP_ARB.0044:3",13,17
-1,0.0,"ان التدريبات ل لايام القادمة","ان منصوب ل الموصوف الموصوف","20000715_AFP_ARB.0044:5",4,8
-1,0.0,"يتفق تماما مع طلب السوق","يفعل منصوب مع المجرور المضاف","20000715_AFP_ARB.0046:4",13,17
-1,0.0,"منذ بدء قمة كامب ديفيد","منذ مجرور المضاف فلان المعرف","20000715_AFP_ARB.0047:1",35,39
-1,0.0,"في باليرمو ( صقلية )","في فلان فلان ","20000715_AFP_ARB.0048:1",16,20
-1,0.0,"حول علاقات ه ب المافيا","حول المجرور ه ب الموصوف","20000715_AFP_ARB.0048:4",19,23
-1,0.0,"جمعت ها ( النيابة )","فعل ها الفاعل ","20000715_AFP_ARB.0048:4",33,37
-1,0.0,"حزب ه السياسي الديموقراطية المسيحية","مجرور ه الموصوف منصوبا الموصوف","20000715_AFP_ARB.0048:5",43,47
-1,0.0,"تولي ه رئاسة الحكومة الايطالية","المجرور ه الموصوف المضاف الموصوف","20000715_AFP_ARB.0048:6",29,33
-1,0.0,"احد محامي اندريوتي جيواكينو سباكي","الفاعل المضاف فلان فلان المعرف","20000715_AFP_ARB.0048:7",3,7
-1,0.0,"يتفق تماما مع طلب السوق","يفعل منصوب مع المجرور المضاف","20000715_AFP_ARB.0049:4",13,17
-1,0.0,"فجوة بين العرض و الطلب","المجرور بين المجرور و الموصوف","20000715_AFP_ARB.0049:6",32,36
-1,0.0,"ضررا لا يمكن اصلاح ه","مجرور لا قال الفاعل ه","20000715_AFP_ARB.0049:6",46,50
-1,0.0,"سبق و اعلن مسؤول كويتي","فعل و فعل الفاعل الموصوف","20000715_AFP_ARB.0049:10",33,37
-1,0.0,"اعتماد ها على عائدات النفط","المجرور ها على الموصوف المضاف","20000715_AFP_ARB.0049:11",39,43
-1,0.0,"سيرغي راشيفسكي المسؤول في الوزارة","فلان المعرف منصوبا في الموصوف","20000715_AFP_ARB.0050:2",3,7
-1,0.0,"في تشركاسي ( وسط )","في فلان منصوبا ","20000715_AFP_ARB.0050:2",14,18
-1,0.0,"حتى ثلاثين مترا في الثانية","حتى 10 المفعول في الموصوف","20000715_AFP_ARB.0050:3",10,14
-1,0.0,"في غرب و جنوب اوكرانيا","في مجرور و الموصوف فلان","20000715_AFP_ARB.0050:4",28,32
-1,0.0,"في دونيتسك ( شرق )","في فلان منصوبا ","20000715_AFP_ARB.0050:5",13,17
-1,0.0,"المفاعل الوحيد العامل في المحطة","المجرور الموصوف الموصوف في مجرور","20000715_AFP_ARB.0050:7",13,17
-1,0.0,"منذ بدء قمة كامب ديفيد","منذ مجرور المضاف فلان المعرف","20000715_AFP_ARB.0051:1",35,39
-1,0.0,"سوى المترجمين و مدوني الملاحظات","سوى المجرور و الموصوف المضاف","20000715_AFP_ARB.0051:3",12,16
-1,0.0,"نزهة في ممرات حديقة المقر","المجرور في الموصوف المضاف المضاف","20000715_AFP_ARB.0051:5",13,17
-1,0.0,"علاوة عن هذين اللقائين الثلاثيين","منصوب عن هذين الموصوف الموصوف","20000715_AFP_ARB.0051:6",4,8
-1,0.0,"( الشوط الاول 13-11 )"," منصوب الموصوف 10 ","20000715_AFP_ARB.0052:1",27,31
-1,0.0,"من كتاب دولة لدى الرئاسة","من مجرور المضاف لدى المجرور","20000715_AFP_ARB.0054:3",10,14
-1,0.0,"لم يسبق ل ها مثيل","لم فعل ل ها الفاعل","20000715_AFP_ARB.0054:4",52,56
-1,0.0,"من مقاعد البرلمان ال 150","من مجرور المضاف ال 10","20000715_AFP_ARB.0054:6",23,27
-1,0.0,"على نتائج ه المدرسية الجيدة","على المفعول ه الموصوف مفعولا","20000715_AFP_ARB.0058:1",43,47
-1,0.0,"قداسا احتفاليا ب عودة اليان","مجرور الموصوف ب مجرور فلان","20000715_AFP_ARB.0058:3",6,10
-1,0.0,"الكنائس البروتستانتينة الكوبية و الاميركية","المجرور البروتستانتينة الموصوف و مفعولا","20000715_AFP_ARB.0058:4",18,22
-1,0.0,"من تموز / يوليو الجاري","من تموز فلان مفعولا","20000715_AFP_ARB.0059:3",21,25
-1,0.0,"بعض البلدان ، مثل السنغال","منصوب المضاف مثل فلان","20000715_AFP_ARB.0059:5",9,13
-1,0.0,"الانتظار حتى تتضح الرؤية جيدا","مجرور حتى يفعل المفعول مفعولا","20000715_AFP_ARB.0059:5",22,26
-1,0.0,"و التي تضم 53 عضوا","و التي يفعل 10 المفعول","20000715_AFP_ARB.0059:7",15,19
-1,0.0,"وصل الي ها اليوم السبت","فعل الي ها منصوب منصوبا","20000715_AFP_ARB.0060:1",24,28
-1,0.0,""" ب ثوب جديد """," ب مجرور الموصوف ","20000715_AFP_ARB.0060:1",55,59
-1,0.0,"خلفا ل ليوغوسلافي ميلان زيفادينوفيتش","منصوب ل الموصوف فلان المعرف","20000715_AFP_ARB.0060:2",12,16
-1,0.0,"و كان يمثل القارة الاسيوية","و كان يفعل المفعول الموصوف","20000715_AFP_ARB.0060:4",34,38
-1,0.0,"س يصل الي ه النصر","س فعل الي ه فلان","20000715_AFP_ARB.0060:5",35,39
-1,0.0,"المنتخبات و ليس الاندية فقط","الفاعل و ليس الموصوف فقط","20000715_AFP_ARB.0060:5",47,51
-1,0.0,"اشراف ي على تدريبات الفريق","المجرور ي على الموصوف المضاف","20000715_AFP_ARB.0060:6",5,9
-1,0.0,"ابتعاد ي في الموسم الماضي","الفاعل ي في الموصوف الموصوف","20000715_AFP_ARB.0060:7",18,22
-1,0.0,"و البقاء مع عائلت ي","و مجرور مع المجرور ي","20000715_AFP_ARB.0060:7",27,31
-1,0.0,"من كتاب دولة لدى الرئاسة","من مجرور المضاف لدى المجرور","20000715_AFP_ARB.0061:3",10,14
-1,0.0,"لم يسبق ل ها مثيل","لم فعل ل ها الفاعل","20000715_AFP_ARB.0061:4",52,56
-1,0.0,"و هو من الوجوه الجديدة","و هو من مجرور الموصوف","20000715_AFP_ARB.0061:5",6,10
-1,0.0,"و موفين مهاشي ب الدفاع","و فلان المعرف ب مجرور","20000715_AFP_ARB.0061:6",10,14
-1,0.0,"ل لعدل و الشؤون البرلمانية","ل مجرور و الموصوف الموصوف","20000715_AFP_ARB.0061:7",24,28
-1,0.0,"من مقاعد البرلمان ال 150","من مجرور المضاف ال 10","20000715_AFP_ARB.0061:8",23,27
-1,0.0,"مهما كانت نتائج عملية الاقتراع","مهما كانت الموصوف المضاف المضاف","20000715_AFP_ARB.0061:9",28,32
-1,0.0,"ب ذلك وقف اطلاق النار","ب ذلك مجرور المضاف المضاف","20000715_AFP_ARB.0062:4",25,29
-1,0.0,"ب ما في ها قوقريال","ب ما في ها فلان","20000715_AFP_ARB.0062:5",11,15
-1,0.0,"راغبين جديا في خوض المفاوضات","مفعولا مفعولا في مجرور المضاف","20000715_AFP_ARB.0062:8",37,41
-1,0.0,"و التمرد في جنوب السودان","و مجرور في الموصوف فلان","20000715_AFP_ARB.0062:9",27,31
-1,0.0,"الاسباني اليكس كوريتخا المصنف اول","الفاعل فلان المعرف الموصوف مفعولا","20000715_AFP_ARB.0064:3",7,11
-1,0.0,"في درسدن ( شرق )","في فلان منصوبا ","20000715_AFP_ARB.0065:1",19,23
-1,0.0,"كانوا يتظاهرون في وسط المدينة","كانوا فعل في المفعول المضاف","20000715_AFP_ARB.0065:1",31,35
-1,0.0,"استدعيت العديد من سيارات الاسعاف","فعل مفعولا من مجرور المضاف","20000715_AFP_ARB.0066:1",18,22
-1,0.0,"( من دون كوسوفو )"," من دون فلان ","20000715_AFP_ARB.0067:4",26,30
-1,0.0,"لا سيما الجيش و الشرطة","لا سيما منصوب و الموصوف","20000715_AFP_ARB.0067:5",19,23
-1,0.0,"حكومة مونتينيغرو الاصلاحية و المؤيدة","الفاعل فلان الموصوف و مفعولا","20000715_AFP_ARB.0067:6",3,7
-1,0.0,"( السلطة في بلغراد )"," الفاعل في فلان ","20000715_AFP_ARB.0067:6",14,18
-1,0.0,"ب حكومت ها المنتخبة ديموقراطيا","ب مجرور ها الموصوف مفعولا","20000715_AFP_ARB.0067:6",32,36
-1,0.0,"( الشوط الاول 24-8 )"," منصوب الموصوف 10 ","20000715_AFP_ARB.0069:1",18,22
